[
  {
    "id": "logic-interface-context",
    "supportLevel": "supported",
    "positivePhrases": [
      "74hc595 shift register state on oled",
      "pcf8574 i2c expander state display",
      "ads1115 adc interface readout",
      "mcp3008 spi adc state display",
      "ne555 timer state display",
      "lm358 op amp signal conditioning display",
      "i2c level shifter voltage domain context",
      "i2c level shifter voltage-domain context",
      "logic interface qualitative state"
    ],
    "requiredEvidence": [
      "74hc595",
      "shift register",
      "pcf8574",
      "gpio expander",
      "ads1115",
      "mcp3008",
      "external adc",
      "spi adc",
      "i2c adc",
      "ne555",
      "555 timer",
      "lm358",
      "op amp",
      "op-amp",
      "level shifter",
      "voltage-domain",
      "logic level converter",
      "레벨 시프터",
      "시프트 레지스터",
      "오피앰프"
    ],
    "negativeEvidence": [
      "bmp280",
      "mpu6050",
      "dht",
      "gps",
      "rfid",
      "rf range",
      "cloud",
      "internet",
      "calibrated",
      "precision",
      "certified",
      "exact frequency",
      "medical",
      "audio power",
      "motor driver",
      "relay driver",
      "power regulator",
      "current booster"
    ],
    "minimumScore": 0.62,
    "studentPhrases": [
      "Show ADS1115 qualitative ADC channel state on the OLED display",
      "MCP3008 SPI ADC 상태를 OLED에 표시",
      "Show 74HC595 shift register state on OLED",
      "PCF8574 I2C expander 상태를 표시",
      "NE555 timer output state를 OLED에 표시",
      "LM358 op amp signal state를 표시",
      "I2C level shifter 3.3V 5V 상태를 보여줘"
    ],
    "inputModalities": [
      "logic-interface",
      "external-adc-interface",
      "shift-register-interface",
      "i2c-interface",
      "spi-interface",
      "timer-interface",
      "opamp-interface",
      "level-shifter-interface",
      "voltage-domain-context"
    ],
    "outputModalities": ["display", "interface-state", "qualitative-readout"],
    "requiredRoles": [
      "controller",
      "power-source",
      "ground-return",
      "logic-interface",
      "i2c-module",
      "i2c-data",
      "i2c-clock"
    ],
    "requiredParts": ["arduino-uno", "breadboard-half", "oled-i2c-096"],
    "optionalParts": [
      "jumper-wire",
      "74hc595-shift",
      "pcf8574-expander",
      "ads1115-adc",
      "mcp3008-adc",
      "ne555-timer",
      "lm358-opamp",
      "i2c-level-shifter",
      "oled-13-i2c",
      "lcd-16x2",
      "lcd-20x4"
    ],
    "protocols": ["gpio", "i2c", "spi", "analog-context", "level-shift", "power"],
    "simulationPrimitives": ["display_sensor_value", "display_static_text", "current_flow_animation"],
    "renderFootprints": [
      "arduino",
      "breadboard",
      "dip-logic-74hc595",
      "i2c-expander-pcf8574",
      "ads1115-adc-module",
      "mcp3008-adc-ic",
      "dip-timer-ne555",
      "dip-opamp-lm358",
      "i2c-level-shifter-module",
      "oled",
      "wire",
      "oled-large",
      "lcd-character-16x2",
      "lcd-character-20x4"
    ],
    "validationRules": [
      "logic-interface-power-ground",
      "logic-interface-signal-required",
      "logic-interface-i2c-pins",
      "logic-interface-spi-pins",
      "level-shifter-voltage-domains",
      "i2c-pin-role-match",
      "common-ground",
      "precision-analog-overclaim-blocked",
      "timer-frequency-overclaim-blocked",
      "level-shift-overclaim-blocked"
    ],
    "commonMistakes": [
      "Routing ADC/op-amp/timer requests through generic sensor display capabilities instead of IC-specific interface context.",
      "Treating qualitative ADC, timer, op-amp, or level-shifter state as calibrated precision analog simulation.",
      "Inferring hidden output pins or downstream loads that are not present in the visual pin map."
    ],
    "safeAlternatives": [
      "i2c-sensor-display-readout",
      "spi-sensor-display-readout",
      "analog-sensor-display-readout",
      "timing-passive-context"
    ]
  }
]
